<?xml version="1.0" encoding="utf-8"?>
<xs:schema xmlns:xs="http://www.w3.org/2001/XMLSchema" attributeFormDefault="unqualified" elementFormDefault="qualified"><xs:simpleType name="yesnoType"><xs:restriction base="xs:string"><xs:enumeration value="Yes"/><xs:enumeration value="No"/></xs:restriction></xs:simpleType><xs:simpleType name="name_extendedType"><xs:restriction base="xs:string"><xs:minLength value="1"/><xs:maxLength value="256"/></xs:restriction></xs:simpleType><xs:simpleType name="sci_idType"><xs:restriction base="xs:string"><xs:minLength value="1"/><xs:maxLength value="20"/></xs:restriction></xs:simpleType><xs:simpleType name="system_typeType"><xs:restriction base="xs:string"><xs:minLength value="1"/><xs:maxLength value="20"/></xs:restriction></xs:simpleType><xs:simpleType name="hierarchy_levelType"><xs:restriction base="xs:string"><xs:minLength value="1"/><xs:maxLength value="1"/><xs:pattern value="[23456]"/></xs:restriction></xs:simpleType><xs:simpleType name="descType"><xs:restriction base="xs:string"><xs:minLength value="1"/><xs:maxLength value="256"/></xs:restriction></xs:simpleType><xs:simpleType name="idType"><xs:restriction base="xs:string"><xs:minLength value="1"/><xs:maxLength value="20"/></xs:restriction></xs:simpleType><xs:simpleType name="not_foundType"><xs:restriction base="xs:string"><xs:enumeration value="positive"/><xs:enumeration value="negative"/></xs:restriction></xs:simpleType><xs:simpleType name="system_rolesType"><xs:restriction base="xs:string"><xs:minLength value="1"/><xs:maxLength value="250"/></xs:restriction></xs:simpleType><xs:simpleType name="store_attributeType"><xs:restriction base="xs:string"><xs:minLength value="1"/><xs:maxLength value="280"/></xs:restriction></xs:simpleType><xs:simpleType name="operatorType"><xs:restriction base="xs:string"><xs:minLength value="1"/><xs:maxLength value="256"/><xs:pattern value="[Ee][Xx][Ii][Ss][Tt]($|:[\w\d_]{1,256})|[Nn][Oo][Tt]_[Ee][Xx][Ii][Ss][Tt]($|:[\w\d_]{1,256})|[Cc][Hh][Ee][Cc][Kk]_[Nn][Oo][Tt][Ee]|[Cc][Hh][Ee][Cc][Kk]_[Nn][Oo][Tt][Ee]:[0-9]{10}"/></xs:restriction></xs:simpleType><xs:simpleType name="nameType"><xs:restriction base="xs:string"><xs:minLength value="1"/><xs:maxLength value="256"/></xs:restriction></xs:simpleType><xs:element name="targetsystem"><xs:complexType><xs:sequence><xs:element maxOccurs="unbounded" minOccurs="1" name="configstore"><xs:complexType><xs:sequence><xs:element maxOccurs="unbounded" minOccurs="1" name="checkitem"><xs:complexType><xs:sequence><xs:element name="compliant" type="xs:string"/><xs:element maxOccurs="1" minOccurs="0" name="complianttext" type="xs:string"/><xs:element name="noncompliant" type="xs:string"/><xs:element maxOccurs="1" minOccurs="0" name="noncomplianttext" type="xs:string"/><xs:element maxOccurs="unbounded" minOccurs="0" name="joinstore"><xs:complexType><xs:sequence><xs:element name="joincompliant" type="xs:string"/><xs:element maxOccurs="1" minOccurs="0" name="joincomplianttext" type="xs:string"/><xs:element name="joinnoncompliant" type="xs:string"/><xs:element maxOccurs="1" minOccurs="0" name="joinnoncomplianttext" type="xs:string"/></xs:sequence><xs:attribute name="name" type="xs:string" use="required"/><xs:attribute default="Yes" name="minus" type="yesnoType" use="optional"/><xs:attribute name="name_extended" type="name_extendedType" use="optional"/><xs:attribute default="No" name="no_data_found" type="yesnoType" use="optional"/><xs:attribute default="No" name="not_in_output" type="yesnoType" use="optional"/><xs:attribute name="sci_id" type="sci_idType" use="optional"/><xs:attribute name="system_type" type="system_typeType" use="optional"/><xs:attribute name="hierarchy_level" type="hierarchy_levelType" use="optional"/></xs:complexType></xs:element></xs:sequence><xs:attribute name="desc" type="descType" use="required"/><xs:attribute name="id" type="idType" use="required"/><xs:attribute default="negative" name="not_found" type="not_foundType" use="optional"/><xs:attribute name="operator" type="operatorType" use="optional"/><xs:attribute name="system_roles" type="system_rolesType" use="optional"/><xs:attribute name="store_attribute" type="store_attributeType" use="optional"/></xs:complexType></xs:element></xs:sequence><xs:attribute name="name" type="nameType" use="required"/><xs:attribute name="name_extended" type="name_extendedType" use="optional"/><xs:attribute name="sci_id" type="sci_idType" use="optional"/><xs:attribute name="system_type" type="system_typeType" use="optional"/></xs:complexType></xs:element></xs:sequence><xs:attribute name="desc" type="descType" use="required"/><xs:attribute name="id" type="idType" use="required"/><xs:attribute default="Yes" name="multisql" type="yesnoType"/></xs:complexType></xs:element></xs:schema>