<?xml version="1.0" encoding="utf-8"?>
<targetsystem xmlns:xsi="http://www.w3.org/2001/XMLSchema-instance" desc="HANA NOTES OF PATCHDAY: 2021-02" id="HPATCHDAY_2021-02" multisql="Yes" version="0000" xsi:schemaLocation="csa_policy.xsd">
  <!--
This FRUN CSA policy contains rules to check the following HANA Security Note:

[p3-CVSS 4.1]  0002992154 HAN-DB-SEC -  [CVE-2021-21474] SAML Assertion Signature MD5 Digest Algorithm Vulnerability in SAP HANA Database

The issue has been fixed with
SAP HANA DATABASE 1.00	SP122	000034 + manual parameter change	
SAP HANA DATABASE 2.0	SP048	000003	
SAP HANA DATABASE 2.0	SP053	000000


SAP Security Patch Day: 2021-02
Version: 001
Date:    10th of Feb 2021
-->
  <!--  [p3-CVSS 4.1] HAN-DB-SEC 0002992154 - [CVE-2020-26834 ] Improper authentication in SAP HANA database (Version 0008)  -->
  <configstore name="HDB_VERSION">
    <checkitem desc="[p3-CVSS 4.1] Note 0002992154 requires revision update" id="00029921548" operator="check_note:0002992154">
      <compliant>
                 (  (NAME = 'VERSION' AND substring(VALUE,0,7) = '2.00.04' AND substring(VALUE,0,11) &gt;= '2.00.048.03')
                 OR (NAME = 'VERSION' AND substring(VALUE,0,7) = '2.00.05' AND substring(VALUE,0,8) &gt;= '2.00.053')
                 OR (NAME = 'VERSION' AND substring(VALUE,0,7) &gt; '2.00.05' ) )  
      </compliant>
      <noncompliant>
	             (  (NAME = 'VERSION' AND substring(VALUE,0,6) = '1.00.0')
	             OR (NAME = 'VERSION' AND substring(VALUE,0,4) = '2.00' AND substring(VALUE,0,7) &lt; '2.00.04')
	             OR (NAME = 'VERSION' AND substring(VALUE,0,7) = '2.00.04' AND NOT(substring(VALUE,0,11) &gt;= '2.00.048.03')) 
                 OR (NAME = 'VERSION' AND substring(VALUE,0,7) = '2.00.05' AND NOT substring(VALUE,0,8) &gt;= '2.00.053')
                 OR (NAME = 'VERSION' AND substring(VALUE,0,6) = '1.00.1' AND NOT(substring(VALUE,0,11) &gt;= '1.00.122.34')) )
      </noncompliant>
      <joinstore name="HDB_VERSION" no_data_found="Yes" not_in_output="Yes">
        <joincompliant>      ( NAME = 'VERSION' AND substring(VALUE,0,4) = '2.00' )
                         OR  ( NAME = 'VERSION' AND substring(VALUE,0,6) = '1.00.1' AND substring(VALUE,0,11) &lt; '1.00.122.34' )
        </joincompliant>
        <joinnoncompliant>   ( NAME = 'VERSION' AND substring(VALUE,0,4) = '2.00' )
                         OR  ( NAME = 'VERSION' AND substring(VALUE,0,6) = '1.00.1' AND substring(VALUE,0,11) &lt; '1.00.122.34' )
       </joinnoncompliant>
      </joinstore>
    </checkitem>
  </configstore>
  <configstore name="HDB_PARAMETER">
    <checkitem desc="[p3-CVSS 4.1] Note 0002992154 requires manual parameter change" id="0002992154" operator="check_note:0002992154">
      <compliant>
              FILE_NAME = 'global.ini' and SECT = 'authentication'  and NAME = 'saml_signature_hash_types'  and not UPPER(VALUE) like '%MD5%' 
    </compliant>
      <noncompliant>      
              FILE_NAME = 'global.ini' and SECT = 'authentication'  and NAME = 'saml_signature_hash_types'  and UPPER(VALUE) like '%MD5%' 
    </noncompliant>
      <joinstore name="HDB_VERSION" no_data_found="Yes" not_in_output="Yes">
        <joincompliant>     NAME = 'VERSION' AND substring(VALUE,0,6) = '1.00.1' AND substring(VALUE,0,11) &gt;= '1.00.122.34'       </joincompliant>
        <joinnoncompliant>  NAME = 'VERSION' AND substring(VALUE,0,6) = '1.00.1' AND substring(VALUE,0,11) &gt;= '1.00.122.34'        </joinnoncompliant>
      </joinstore>
    </checkitem>
  </configstore>
</targetsystem>